{
  "items": [
    {
      "recordId": "record-1",
      "action": "single",
      "planId": "plan-3",
      "planCode": "APS-2026-0003",
      "machineId": "machine-1",
      "machineName": "Laser-01",
      "operator": "scheduler",
      "status": "scheduled",
      "note": "seed schedule",
      "createdAt": "2026-02-23T08:00:00Z"
    }
  ],
  "total": 1,
  "page": 1,
  "pageSize": 20
}
