{
  "items": [
    {
      "planId": "plan-1",
      "planCode": "APS-2026-0001",
      "orderCode": "ORD-2026-0201",
      "layoutCode": "L-0201-01",
      "material": "Q235-6mm",
      "priority": 1,
      "dueAt": "2026-02-23T08:00:00Z",
      "status": "pending",
      "machineId": null,
      "updatedAt": "2026-02-23T08:00:00Z"
    },
    {
      "planId": "plan-2",
      "planCode": "APS-2026-0002",
      "orderCode": "ORD-2026-0202",
      "layoutCode": "L-0202-01",
      "material": "304-3mm",
      "priority": 2,
      "dueAt": "2026-02-23T09:00:00Z",
      "status": "ready",
      "machineId": null,
      "updatedAt": "2026-02-23T08:00:00Z"
    },
    {
      "planId": "plan-3",
      "planCode": "APS-2026-0003",
      "orderCode": "ORD-2026-0203",
      "layoutCode": "L-0203-02",
      "material": "AL6061-4mm",
      "priority": 3,
      "dueAt": "2026-02-23T10:00:00Z",
      "status": "scheduled",
      "machineId": "machine-1",
      "updatedAt": "2026-02-23T08:00:00Z"
    }
  ],
  "total": 3,
  "page": 1,
  "pageSize": 20
}
